{
 "schema_version": 1,
 "candidate_release_id": "populace-us-2024-9f1260b-20260611",
 "incumbent_manifest": "pinned-production-ecps-2024",
 "period": 2024,
 "metric": "sound_ecps_replacement_comparison",
 "baseline_label": "enhanced_cps",
 "candidate_label": "populace",
 "protocol": "Matched 41,314 households, symmetric refit, 739-target holdout (seed 20260529).",
 "provenance": {
  "derived_from": "policyengine/populace-us releases/populace-us-2024-9f1260b-20260611/sound_ecps_replacement_comparison.json",
  "note": "Archived incumbent comparison; recomputing requires the candidate and pinned-incumbent HDF5 artifacts."
 },
 "summary": {
  "candidate_loss": 0.227943,
  "baseline_loss": 1.40549,
  "loss_delta": -1.17755,
  "candidate_holdout_loss": 0.0383735,
  "baseline_holdout_loss": 0.316697,
  "candidate_train_loss": 0.189569,
  "baseline_train_loss": 1.08879,
  "candidate_unweighted_msre": 0.23306,
  "baseline_unweighted_msre": 1.32102,
  "candidate_wins": 1040,
  "baseline_wins": 2613,
  "ties": 51,
  "n_targets": 3704,
  "holdout_targets": 739,
  "train_targets": 2965,
  "candidate_beats_baseline": true,
  "matched_household_count": 41314
 },
 "family_breakdown": [
  {
   "baseline_loss_contribution": 0.000202606,
   "baseline_wins": 624,
   "candidate_loss_contribution": 2.63978e-05,
   "candidate_wins": 405,
   "family": "national_irs_other",
   "holdout_targets": 212,
   "loss_delta": -0.000176208,
   "n_targets": 1060,
   "ties": 31,
   "train_targets": 848
  },
  {
   "baseline_loss_contribution": 0.000149663,
   "baseline_wins": 758,
   "candidate_loss_contribution": 1.89392e-05,
   "candidate_wins": 260,
   "family": "state_agi_distribution",
   "holdout_targets": 204,
   "loss_delta": -0.000130723,
   "n_targets": 1019,
   "ties": 1,
   "train_targets": 815
  },
  {
   "baseline_loss_contribution": 1.82942e-05,
   "baseline_wins": 1,
   "candidate_loss_contribution": 1.13257e-08,
   "candidate_wins": 4,
   "family": "national_tax_expenditures",
   "holdout_targets": 1,
   "loss_delta": -1.82829e-05,
   "n_targets": 5,
   "ties": 0,
   "train_targets": 4
  },
  {
   "baseline_loss_contribution": 4.89806e-06,
   "baseline_wins": 719,
   "candidate_loss_contribution": 9.79996e-06,
   "candidate_wins": 176,
   "family": "state_age_distribution",
   "holdout_targets": 180,
   "loss_delta": 4.9019e-06,
   "n_targets": 900,
   "ties": 5,
   "train_targets": 720
  },
  {
   "baseline_loss_contribution": 3.52091e-07,
   "baseline_wins": 70,
   "candidate_loss_contribution": 1.0432e-06,
   "candidate_wins": 16,
   "family": "national_population_by_age",
   "holdout_targets": 17,
   "loss_delta": 6.91108e-07,
   "n_targets": 86,
   "ties": 0,
   "train_targets": 69
  },
  {
   "baseline_loss_contribution": 1.71619e-06,
   "baseline_wins": 232,
   "candidate_loss_contribution": 2.26669e-06,
   "candidate_wins": 111,
   "family": "other",
   "holdout_targets": 70,
   "loss_delta": 5.50497e-07,
   "n_targets": 348,
   "ties": 5,
   "train_targets": 278
  },
  {
   "baseline_loss_contribution": 1.15573e-07,
   "baseline_wins": 46,
   "candidate_loss_contribution": 5.64995e-07,
   "candidate_wins": 4,
   "family": "state_population_under_5",
   "holdout_targets": 10,
   "loss_delta": 4.49421e-07,
   "n_targets": 52,
   "ties": 2,
   "train_targets": 42
  },
  {
   "baseline_loss_contribution": 3.37894e-08,
   "baseline_wins": 39,
   "candidate_loss_contribution": 3.5946e-07,
   "candidate_wins": 12,
   "family": "state_aca_enrollment",
   "holdout_targets": 10,
   "loss_delta": 3.25671e-07,
   "n_targets": 51,
   "ties": 0,
   "train_targets": 41
  },
  {
   "baseline_loss_contribution": 2.06017e-07,
   "baseline_wins": 36,
   "candidate_loss_contribution": 5.15114e-07,
   "candidate_wins": 15,
   "family": "state_snap_cost",
   "holdout_targets": 10,
   "loss_delta": 3.09096e-07,
   "n_targets": 51,
   "ties": 0,
   "train_targets": 41
  },
  {
   "baseline_loss_contribution": 7.38489e-07,
   "baseline_wins": 9,
   "candidate_loss_contribution": 1.01514e-06,
   "candidate_wins": 8,
   "family": "national_census_other",
   "holdout_targets": 4,
   "loss_delta": 2.76646e-07,
   "n_targets": 22,
   "ties": 5,
   "train_targets": 18
  },
  {
   "baseline_loss_contribution": 3.06769e-07,
   "baseline_wins": 1,
   "candidate_loss_contribution": 1.2182e-07,
   "candidate_wins": 4,
   "family": "national_ssa",
   "holdout_targets": 1,
   "loss_delta": -1.84949e-07,
   "n_targets": 5,
   "ties": 0,
   "train_targets": 4
  },
  {
   "baseline_loss_contribution": 4.62669e-07,
   "baseline_wins": 31,
   "candidate_loss_contribution": 3.73515e-07,
   "candidate_wins": 20,
   "family": "state_snap_households",
   "holdout_targets": 10,
   "loss_delta": -8.91541e-08,
   "n_targets": 51,
   "ties": 0,
   "train_targets": 41
  },
  {
   "baseline_loss_contribution": 5.94819e-08,
   "baseline_wins": 45,
   "candidate_loss_contribution": 1.25159e-07,
   "candidate_wins": 5,
   "family": "state_population",
   "holdout_targets": 10,
   "loss_delta": 6.56774e-08,
   "n_targets": 52,
   "ties": 2,
   "train_targets": 42
  },
  {
   "baseline_loss_contribution": 2.48211e-11,
   "baseline_wins": 1,
   "candidate_loss_contribution": 6.13654e-09,
   "candidate_wins": 0,
   "family": "national_infants",
   "holdout_targets": 0,
   "loss_delta": 6.11172e-09,
   "n_targets": 1,
   "ties": 0,
   "train_targets": 1
  },
  {
   "baseline_loss_contribution": 4.86085e-11,
   "baseline_wins": 1,
   "candidate_loss_contribution": 7.48223e-11,
   "candidate_wins": 0,
   "family": "national_net_worth",
   "holdout_targets": 0,
   "loss_delta": 2.62138e-11,
   "n_targets": 1,
   "ties": 0,
   "train_targets": 1
  }
 ],
 "top_improvements": [
  {
   "baseline_abs_scaled_error": 0.479335,
   "baseline_error": 0.479335,
   "baseline_estimate": 0.499563,
   "baseline_loss_term": 0.229762,
   "baseline_relative_error": 1.45,
   "candidate_abs_scaled_error": 0.00202215,
   "candidate_error": 0.00202215,
   "candidate_estimate": 0.02225,
   "candidate_loss_term": 4.08908e-06,
   "candidate_relative_error": 0.982155,
   "family": "national_irs_other",
   "loss_delta": -0.229758,
   "split": "train",
   "target_index": 576,
   "target_name": "nation/irs/adjusted gross income/total/AGI in 79m-inf/taxable/All",
   "target_value": 0.0202278,
   "value_scale": "scaled",
   "winner": "candidate"
  },
  {
   "baseline_abs_scaled_error": 0.374737,
   "baseline_error": 0.374737,
   "baseline_estimate": 0.38893,
   "baseline_loss_term": 0.140428,
   "baseline_relative_error": 1.3555,
   "candidate_abs_scaled_error": 0.00016163,
   "candidate_error": -0.00016163,
   "candidate_estimate": 0.0140317,
   "candidate_loss_term": 2.61244e-08,
   "candidate_relative_error": 0.985846,
   "family": "state_agi_distribution",
   "loss_delta": -0.140428,
   "split": "train",
   "target_index": 3581,
   "target_name": "state/WV/adjusted_gross_income/amount/1000000_inf",
   "target_value": 0.0141933,
   "value_scale": "scaled",
   "winner": "candidate"
  },
  {
   "baseline_abs_scaled_error": 0.369288,
   "baseline_error": 296062.0,
   "baseline_estimate": 312278.0,
   "baseline_loss_term": 0.136374,
   "baseline_relative_error": 18.2564,
   "candidate_abs_scaled_error": 0.00438848,
   "candidate_error": 3517.31,
   "candidate_estimate": 19733.2,
   "candidate_loss_term": 1.92588e-05,
   "candidate_relative_error": 0.216953,
   "family": "national_irs_other",
   "loss_delta": -0.136355,
   "split": "holdout",
   "target_index": 386,
   "target_name": "nation/irs/partnership and s corp losses/count/AGI in 20k-25k/taxable/All",
   "target_value": 16215.9,
   "value_scale": "native",
   "winner": "candidate"
  },
  {
   "baseline_abs_scaled_error": 0.282962,
   "baseline_error": 0.282962,
   "baseline_estimate": 0.30319,
   "baseline_loss_term": 0.0800674,
   "baseline_relative_error": 1.25752,
   "candidate_abs_scaled_error": 0.0202278,
   "candidate_error": -0.0202278,
   "candidate_estimate": 0.0,
   "candidate_loss_term": 0.000409165,
   "candidate_relative_error": 0.960346,
   "family": "national_irs_other",
   "loss_delta": -0.0796583,
   "split": "train",
   "target_index": 31,
   "target_name": "nation/irs/adjusted gross income/total/AGI in 20k-25k/taxable/Married Filing Jointly/Surviving Spouse",
   "target_value": 0.0202278,
   "value_scale": "scaled",
   "winner": "candidate"
  },
  {
   "baseline_abs_scaled_error": 0.257691,
   "baseline_error": 0.257691,
   "baseline_estimate": 0.277918,
   "baseline_loss_term": 0.0664045,
   "baseline_relative_error": 1.23275,
   "candidate_abs_scaled_error": 0.00211706,
   "candidate_error": -0.00211706,
   "candidate_estimate": 0.0181108,
   "candidate_loss_term": 4.48196e-06,
   "candidate_relative_error": 0.978098,
   "family": "national_tax_expenditures",
   "loss_delta": -0.0664,
   "split": "train",
   "target_index": 1475,
   "target_name": "nation/jct/charitable_deduction_expenditure",
   "target_value": 0.0202278,
   "value_scale": "scaled",
   "winner": "candidate"
  },
  {
   "baseline_abs_scaled_error": 0.242715,
   "baseline_error": 0.242715,
   "baseline_estimate": 0.256909,
   "baseline_loss_term": 0.0589107,
   "baseline_relative_error": 1.22532,
   "candidate_abs_scaled_error": 0.00130261,
   "candidate_error": 0.00130261,
   "candidate_estimate": 0.0154959,
   "candidate_loss_term": 1.6968e-06,
   "candidate_relative_error": 0.98729,
   "family": "state_agi_distribution",
   "loss_delta": -0.058909,
   "split": "train",
   "target_index": 3112,
   "target_name": "state/AK/adjusted_gross_income/amount/1000000_inf",
   "target_value": 0.0141933,
   "value_scale": "scaled",
   "winner": "candidate"
  },
  {
   "baseline_abs_scaled_error": 0.239979,
   "baseline_error": 0.239979,
   "baseline_estimate": 0.254172,
   "baseline_loss_term": 0.0575899,
   "baseline_relative_error": 1.22263,
   "candidate_abs_scaled_error": 0.00272689,
   "candidate_error": 0.00272689,
   "candidate_estimate": 0.0169202,